<?xml version="1.0" encoding="UTF-8" ?>
<PerformanceDataQueryResults xmlns:xsi="http://www.w3.org/2001/XMLSchema-instance" xsi:noNamespaceSchemaLocation="http://host:50000/mdt/monitor/PerformanceDataQuery.xsd">
	<Result>
		<Code>MISSING_PARAM</Code>
		<Details>component</Details>
		<Text>No&#x20;PI&#x20;Component&#x20;name&#x20;supplied.</Text>
	</Result>
	<UsageTypes>
		<Usage>
			<URL>http://host:50000/mdt/performancedataqueryservlet</URL>
			<Description>Overview over available PI Components.</Description>
		</Usage>
		<Usage>
			<URL>http://host:50000/mdt/performancedataqueryservlet?component=&lt;PIComponentName&gt;</URL>
			<Description>Request the Performance metadata of a PI Component.</Description>
		</Usage>
		<Usage>
			<URL>http://host:50000/mdt/performancedataqueryservlet?component=&lt;PIComponentName&gt;&amp;begin=&lt;IntervalBeginTime&gt;&amp;end=&lt;IntervalEndTime&gt;</URL>
			<Description>Request the Performance data of a PI Component for the specified view and time interval.</Description>
		</Usage>
	</UsageTypes>
	<XIComponents>
		<Component>af.sid.db0</Component>
		<Component>af.sid.db1</Component>
		<Component>af.sid.db2</Component>
	</XIComponents>

</PerformanceDataQueryResults>
